"FmcO7b","vWB2ve","T7nuU 2","gjvCCd"
"Mason Dunn","10 months ago","I typically don't go out of my way to do reviews, but my God what a game. The cinematics mended in to the game play is just beautiful. This game has it all.... adventure, beauty, screams, horror, action that kept me wanting to play. Make sure you have a really good headset so you can fully enjoy all of the sounds and voices that really draw you in to this game. Of course if you haven't yet, play the first Hellblade and you won't be near as lost in this one. This franchise has been one of my favorites and most enjoyable to play.","1 person found this helpful."
"Liam Bradbury Music","10 months ago","Weird game. Feels more like a graphical showcase than a game.

Good points:
* Amazing graphics 
* Music is excellent 
* Quite scary in places, psychological horror

Bad points:
* Large parts of the game are just walking in slow motion while dialogue plays. Either walking or climbing or crawling through narrow caves and you do it really slowly too.
* Puzzles are repetitive and simple 
* Only 7 hours long.

Gave it a 5 / 10 because although large parts are extremely boring - mainly walking from cutscene to cutscene, there is a brilliance about it. The excellent graphics certainly helps and the music adds to the moods well.

I should note that I only realised you can roll while fighting to avoid certain attacks 3/4's of the way through the game due to there being zero on screen display or tutorials.","5 people found this helpful."
"Kurt Zelasko","10 months ago","I’ve seen a lot of people express their disappointment in this game, and it paints this picture that people don’t really know what a video game is. 

A video game is an interactive digital media used as a form of entertainment. The first we get ahead in technology, the more we are able to tell a more polished and nuanced story. 

Hellblade 2 is an incredible example of this, foregoing a ton of “gameplay” as to put you behind the steering wheel of a narrative that really, plays itself. This game has a photo mode available at the press of a button, and every single inch of this game has plenty of opportunity you to take advantage of it. 

If you’re expecting a ton of combat, crazy boss fights… this game WILL disappoint you. But if you accept this game for what it is, rather than what you wanted  - a sensory filled, narrative driven experience- then you will absolutely love this beauty of a piece of media.

It’s out on gamepass, which is 20 dollars a month. You’ll beat it in a day or two, and you’ll go “man, that was something.” 

And that’ll be enough.","2 people found this helpful."
"babak Ranjbaran","8 months ago","If you like Fortnite, this game may not be suitable for your tastes. Senua's Saga: Hellblade II is a unique and immersive storytelling experience rather than traditional gaming. When I played the first game, I was thoroughly impressed, but the second game exceeded all my expectations. The combat sequences were expertly crafted, and the cinematography was simply breathtaking. Senua's character development has made her one of my all-time favorites.","Was this review helpful to you?"
"lee riley","10 months ago","THE most beautiful console game I've ever seen. Nothing comes close to the visuals in this game. It's not so much a game, it's an experience. And one that everyone should play at least once.

Everything from the acting to the soundtrack is on another level. The gameplay is very slight and I would of preferred more protracted, more frequent battles but as I said, it's an experience. More akin to a movie than a video game.

The battles are close, with four moves on offer, dodge, block, light attack, heavy attack., and the moves all feel grounded and weighty. You feel every block and strike. That being said the animations, although fluid and lifelike, are repeated and it's obvious to spot which detracts from the immersion. It's not open world and there are no choices to be made, which i would of loved as the story seems like there are choices but there's none, on rails with only one path to go.
It's far from perfect but it's one hell of an experience.","1 person found this helpful."
"Mark Walsh","9 months ago","This game is a master piece and I consider it to be one of the best games I've ever played. Certainly the best on this generation of consoles. If your looking for incredible graphics, amazing story telling then you're in for a treat. Some people complain about the combat in this game but for me personally I enjoyed it and found it challenging. Congratulations to Ninja Theory and everyone involved on such a stellar game. I hope we get more of this. 🙌","Was this review helpful to you?"
"Desiree Cameron","9 months ago","5 years of waiting for 5 hours of disappointing gameplay. Visually stunning but seems that's all they really put the effort into. The story is okay but doesn't even remotely seem to connect to the first what so ever and the parts that do are so jumbled and scattered throughout to try to add some sort of connection. Forced walking and drawn out cinematics, like unnecessarily long crawling through holes and squeezing through cracks or staring at the scenery for longer than necessary. Just an all around ridiculous amount of filler. Not to mention the copy and paste puzzles with a different look but the exact same layout. Newer enemies yet smaller one on one fights and as long as you dodge and land shots can kill most enemies in 5 hits. Really haven't been this disappointed for a drawn out game release since KOH4. This game could of had so much potential but may as well just been marketed as a playable movie.","10 people found this helpful."
"Nathan Minter","9 months ago","Anyone who doesn't appreciate the work that has gone into this game fails to see how amazing it is that games have come to this point and probably haven't been. Alive long enough to really see the full scope. The visuals in this game are amazing. All of the particles, effects, small details in the rock and landscape blow my mind. Love the way they tell this story. Makes me feel like I'm playing a movie. Amazing story telling!","1 person found this helpful."
"James S","10 months ago","Thoroughly enjoyed this game. The narrative and visuals were masterful. The combat was gritty and fluid. I absolutely love how the game makes every scene so cinematic & personal. The narrator gave me ASMR, though the psychosis was a bit much. Redemption arc’s were very satisfying. The puzzles were easier than the first game, but that’s okay, because I came for the story and combat. Favorite part? Matching your motion/ actions to the beat of the music - what a creative way to spin the combat and action sequences!

I highly recommend this series, and I’ll be looking forward to the next installment!","2 people found this helpful."
"Jeet Parikh","10 months ago","This game is the proof of the Technological Marvel. Perfectly Made, the details, the story, the Acting, THE GRAPHICS, STUNNING VISUAL. Its the perfect cinematic experience but in the form of a VIDEO GAME. Hellblade 1 was really good, but this right here is MARVELLOUS. 10/10 for me. Best game ever Made. And I AM saying this is GOTY right here. 
ALSO This game is not a horror game. Its dark and have some disturbing moments but its sort of an action/adventure, with Senua’s Psychosis giving her the motivation she needs and instantly doubting themselves the very next second🤣 Classic Hellblade Experience just like its prequel. Loved the ASMR obviously. 
100% RECOMMENED","1 person found this helpful."
"Jake Allen","9 months ago","I did not play the first game, im downloading it now after finishing the 2nd. This game is intense! Very well done and i highly recommend giving it a playthrough. I watched some negative reviews on youtube and thought it my duty to defend this game in what little way i can through this rating/review. I felt as if i was fighting for my life in almost every combat encounter and it could very well be the end of the journey. I will be playing this again","Was this review helpful to you?"
"Tony Silva","8 months ago","I just finished the game, and I truly loved the first one because I'm crazy about ancient peoples, ancient religions, Nordic paganism, Celtic people, and all that. I was truly expecting to play this game.

So, the first things, which are things I don't care much about, are graphics and gameplay. That's a 10/10 for the graphics; the quality of the graphics is insane. They are better than the first one, which was already amazing. Now, the gameplay doesn't change much, but it is enjoyable. I like the combat system, but I hated the puzzles since the first one. The gameplay can get, and probably will get, repetitive. That's a 5/10.

The soundtrack is cool, could have been better. They had this amazing band called Heilung doing the songs, and if you know Heilung, you know what they can do. It's a 7/10, could have been 10.

Actors: The actress who plays Senua is incredible, that's a 10/10 too. And all the others did well too.

Now, what I do care about when I play games is the story, and that's a personal thing for me. If you hate games that feel more like movies, this isn't for you. And maybe I would have enjoyed it more if the writing was better. I loved the story of the first game, and it's a whole saga about Senua, about her sacrifice, her life, etc., and it's beautifully done. Now, on this one, I didn't feel truly connected to the story. It wasn't personal enough, I guess, and I couldn't find myself truly connected to the characters in the story, like we all did with Senua in the first game. This just didn't click; I didn't like the story or the way they took it.

What I liked was the emphasis on the Norsemen, brutal as they were, and I would love if they got more into that, more human things.

But overall, and it makes me sad to say this, but I think they only made this game because they felt like it needed to be made or something, I don't know. Because the first one had a whole lot more soul, without being with Microsoft or having that much of a budget. If they had no better story to continue, maybe they just shouldn't have continued.

Overall, feels just an unnecessary sequence, empty characters, an empty story.

I feel sad because I truly loved the first one, but I couldn't get myself to connect with the story of this one.

So, it's a 3/5.","2 people found this helpful."
"Z Botz","10 months ago","Just finished this grueling masterpiece last night. Graphics 10. Gameplay 4, due to a lot of walking! Audio 10, freaking scary voices that still remain in my head! Puzzles 7, not too hard. Battle Physics 7. Where this is not close to ACVH or Ghosts of Tsushima, limited controls and weapons. Just after beating the game I immediately went back to an early chapter to fight the Druids! Overall 7. Where this game lacks in gameplay, the graphics, visuals and audio make up for it! It is terrifyingly gruesome! This was a bit f a grind, couldn’t stop playing because I wanted to battle more demons! Definitely not meant for children! You will fall in love with Senua and if you survive or not you will want MORE out of this game!!!","1 person found this helpful."
"Ben Robinson","5 months ago","Hellblade 2 picks up brilliantly after the first title, with a recap of the original story for those who haven't played it, and if you have then you'll find this game much the same. There are the graphic and gameplay improvements that you'd expect with next gen sequel but otherwise this game doesn't offer much that's new. It seems that the mold wasn't broken when Senua's Sacrifice was released but it definately couldn't be bettered either. The original grabbed me from beginning to end but I have found myself getting bored at times playing this one, it's as dark and as emersive but this really is why I got bored - I felt that I'd played it already. 
If you didn't play the original then get on your own in a dark room and you'll love this, but if you did play the original don't expect anything more than what you've already done.","Was this review helpful to you?"
"Daniel Bagley","a month ago","A true masterpiece!! Hands down the best game I've ever played! Visually stunning at every second. I often stopped to admire the breathtaking scenery and detail. Absolutely beautiful! The storyline was captivating and engaging with no down time or boring moments. The gameplay was smooth and flawless unlike anything i've ever seen before. I couldn't put it down or stop thinking about it. We need more games like this. Period.","Was this review helpful to you?"
"Steve Fanion","9 months ago","Hellblade 2 is AMAZING!!! I absolutely LOVE IT!!! Hellblade 2 is a true cinematic MASTERPIECE! The graphics are AWESOME, the frame rate is GREAT, it runs so SMOOTH, the story is FANTASTIC, the combat is VERY SATISFYING, the cut scenes are INCREDIBLE, and the transitions are so SMOOTH and SEAMLESS, the voice acting is WONDERFUL, and the entire mood of the game is just so PERFECT!!! This game gets a PERFECT SCORE!!! If you are wondering about the people who gave this game a 1 star review here is something you might find interesting. My friend who owns a PS5 gave it a 1 star. But the interesting thing is that he wanted to play the game every time he came over since it came out. He said he loves it, so when I asked him why he gave it a 1 star review his answer was. "" I'm a PlayStation guy, and since it's not coming out on the PS5 I gave it a 1"". He then said all PS5 fanboys give every Xbox  Series X game a 1 if the game does not come out on PS5. I just find that way of thinking so weird and kind of funny!!! LOL!!!","Was this review helpful to you?"
"Christian Huye","9 months ago","1/5 stars if u actually payed full price for this game. 2/5 if u got it free on Game Pass. Everybody giving this game a 5/5 claiming it’s the best graphics in gaming are brain dead when it’s a 6-8 hour walk and talk game with easier puzzles than I played in Zelda games on Nintendo. Only things worth mentioning are graphics and the “Binaural audio” which again it’s a 7 hour walking game with combat that’s honestly so easy it’s criminal any enemy can be beat by Parrying 3 times and there’s no differences in the enemy mechanics just how they look. If anybody gives this $50 5 hour game a 5/5 they’re lying to promote buying this garbage walking simulator to either help the studio or help Microsoft. The story is eh no characters that are interesting or awesome but it tells a somewhat interesting story. Can’t believe some people got tricked into buying this mid. If they say 5/5 I’m convinced they never played a 5/5 game and that’s facts.","10 people found this helpful."
"Billy","3 days ago","First one was my absolute favourite game, this one is basically an unreal engine cutscene, hold forward and hammer the A button to play through except she can't step over a pebble and there's no indication of where to go so even getting past the first level is as frustrating as it gets. Graphics are cranked up so much that an albeit older graphics card which can still play most modern games struggles on the lowest setting.... proper gutting, about the only scottish video game character in existance (although she has a London accent for some unholy reason) with an interesting premise turned into ""look at how good our graphics are"". Sorry Senua, best to leave your adventure at your sacrifice as your saga is bogin.","Was this review helpful to you?"
"Eric Thomas","10 months ago","The story and gameplay is as expected from the previous installation. I do play on a 1440p 4070ti setup on PC. Only issue I currently have is that the graphics are meh in a sense that the upscalers kinda hold it back on PC. I will definitely download on the series x to see what 4k offers. But I prefer my 80 to 90 fps. But it should be a full blown cinematic experience. Aka full resolution needed. @xbox you should have given this game more attention. Because of your choices lately this game will carry most of the generation this year. Solid game at the end of the day. I just also feel Xbox pushed this game out the door just a little, not a lot out the door. Highly recommend this game and the team behind it. Attention to detail is a major plus!","1 person found this helpful."
"Cindy Carver","10 months ago","Audio, visual masterpiece...it's completely engrossing. I would much rather play a 7 hr game that's amazing than 100 hr game that's boring. This does what it sets out to brilliantly. The combat is brutal. If you are an action junkie it may not be for you,  but if you appreciate narrative, cinematic games you will absolutely love it. The audio is some of the best I've ever heard. The psychosis voices are so real sounding . I absolutely loved the game.","1 person found this helpful."
"Vaniel Smegan","9 months ago","Loved the first game and was really looking forward to this. Sadly, it's a linear walking sim with repetitive, simple puzzles, non existent combat and gameplay (it's literally walk, talk, cinematic, repeat) and a gorgeous but sterile and restrictive environment you can't explore or interact with.

Half of the dialogue is pretentious non sense and the overall story is maybe 2-3 hrs that is padded and slowed down to make it last 5-6 hrs. The constant ""chatter"" in Senuas head gets pretty annoying, adds little to her character, and becomes a distraction when trying to listen to the general conversations. Use it tastefully to provide perspective, depth and highlight inner turmoil. Not every. Single. Sentence.

All it has going for it are the graphics and audio. Feels more like an art project or a demo for the Unreal Engine than a game. Glad it's on Xbox Game pass - would have sucked to pay full price for it.","4 people found this helpful."
"E H (El)","10 months ago","I played the first ons and was so exited and this did not disappoint only one collectable like the first one so you have a better experience actually playing the game and following the story, wish other games  followed this play style with fantastic story and fighting and less nonsense content filling with 1000,s of collectables. 
Story great looks amazing fights are good to the combat is harder than the first hellblade but to be fair it should be. Thanks for another amazing game loved it","Was this review helpful to you?"
"Ralph England","10 months ago","Graphics are amazing.

Gameplay is awful.  The combat in the first was simple, but elegant and surprisingly skillful. In the sequel it's awkward and artificial. Your move set is smaller, strategy very limited. Enemies face you 1v1 despite times when Senua is surrounded. 

The story in the first was great- touching, relatable,  well acted. You were never sure of what was real or not. In the sequel the supernatural is confirmed to exist, making the psychosis Senua suffers from a gimmick- a cheap set of voiced in your ear- rather than a driving force behind the action and gameplay.

And you're forced to walk so often. You can HOLD the SPRINT button to walk slightly faster. The 5 hour run time could easily have been 4 just by letting you run more often.

Don't buy. Play on gamepass if you have it. If you don't have game pass you're not missing much.","11 people found this helpful."
"Erik Lunde","9 months ago","After a rather miserable start, both thematically and mechanically, the game finds its voice(s) many steps later, when a poignant tale of psychological freedom emerges. In the first game, Senua confronts and overcomes the demons in herself, and now this game pivots to her helping others to do the same. The ending blew me away in terms of how deep the characters and their experiences go. I will never forget the line ""you must show them a different way"" in the context of dealing with psychosis, breaking free from a brutally dark past, and turning away from the path your ancestors carved for you. While I wish this had been the focus from the start in this game, the final two chapters displayed a mastery of scripting, A/V direction, and game design I won't soon forget.","Was this review helpful to you?"
"DMX 2K20","9 months ago","This is a great game. I loved what they’ve done to increase the graphics and audio, it was phenomenal playing this game, a truly immersive experience. However, I didn’t like how you can only fight one person at a time, but the combat was for more fluid and realistic. The game being only 6 hours is a bummer, but the story was in fact amazing. I would give this a game 8.5/10","Was this review helpful to you?"
"Josef El Finito","3 months ago","Ninja theory, really? This is what you developed for about 7 years?

Dumb
Uninspiring
Lack of creativity 
Copy and paste
Boring walking simulator
Poor story
Too much talking 😡

I see some clowns saying ""if you like the first game you're gonna like this as well"". No, I love the first hellblade and I hate this garbage. 5 star reviews from blind idiots that knows nothing but pretty graphics and visuals.

Hellblade 1 has a soul. It felt pretty original and authentic, quality binary sounds, great story, 2 enemies at a time and clean combat.

 I thought HB2 was really going to improve from the first one, come out strong as a rivalry with sony's god of war but failed big time. What is this? God of war succeeded because of the gameplay, the last of us 2 succeeded because of the gameplay even though some folks don't like the story but they still find the gameplay fun. 

Ninja theory; I want to play a game, I want to play gameplay not empty and boring good looking graphics and visuals. This is really bad. 99 percent walking, 1 percent combat. Lazy ass developers spent 7 years developing pretty graphics. 

Glad I got it for free. Don't waste ur money on this crap, just watch the game on YouTube. Believe the 1 star reviews. If you want to play hellblade just play the first one. I don't know what this is. 🤦‍♂️","1 person found this helpful."
"Eric Wells","10 months ago","Some of these reviews are hilarious. I read one that said this game is super immersive. Just wow. This game is far from immersive. It's basically a really good movie. A pretty gnarly movie. There's not much gameplay other than walking around. The combat looks super cool, but is very basic due to there being only 4 buttons you need to push (parry, dodge, attack, and heavy attack). There's no skill tree, no weapons upgrade, or character building. You're basically walking through a super gnarly movie with the occasional puzzle and occasional combat. This could have been a great game, a masterpiece. However, they decided to make a movie instead. I'd recommend playing it if you have game pass and you're in a chill mood looking for a good movie to watch. I'd be upset if I spent money on this game though.","1 person found this helpful."
"Vinnie Barberino","10 months ago","Unbelievable gameplay! I have been waiting for a game like this for a very long time. Thank you xbox studio and Ninja Theory . We need more!!!!! Dark theme and great continuation of the first game. Graphics are A+. Great showcase for the tech. Played on both console and pc. No problems. Day one was amazing. Can wait to play tomorrow.","3 people found this helpful."
"Boston Stevens","10 months ago","There are many things I loved about the game. The graphics are incredible, the game ran very smoothly, and the combat was alot of fun. There is many things that they changed compared to the first one. In the first Hellblade, if you died to many times, you had to restart the entire game (I completed it my first playthough). It made the game way more intense and I loved it. It was way more challenging fighting multiple opponents at once. The bosses in the first one were incredible as well, but this game didn't have any boss fights with special moves and the combat was very easy. It was like playing through a 6 hour movie. I still enjoyed the game alot even though it was short. I recommend playing the game even though it doesn't come close to the greatness of the first game. (Also I have Game Pass, do not spend $50 on this game)","1 person found this helpful."
"Richard Inks","10 months ago","Waited years for this and all I ended up with was disappointment and regret. One less Game Pass PC subscriber. What is even going on at Xbox any more? This will need to be multiplatform to save the money Microsoft is losing by paying the devs and having it on Game Pass for $10 with every other game. At least with God of War I got to play the game after a long cutscene. This game... it's basically playing The Order only with less action. Sure, it's sort of cerebral, but this was done in the first game. Was hoping for something new and fresh, like a take on a female viking version of God of War, but no. Super linear, on rails walking simulator with frequent cutscenes to show off where all the money went: facial animations. It sure wasn't spent on gameplay or other graphics. Everything is so blurry and muddy, I can't imagine playing it on Series S let alone X.","17 people found this helpful."
"Tiara Stork","10 months ago","Definitely a major improvement from the first game in terms of battle play. Graphic are amazing too. So far the story telling is interesting and has some depth to it.

Definitely been worth the wait!

The voices are much more of an improvement as well, you can actually hear what they are saying and there are good voices and then the more negative voices.","18 people found this helpful."
