"FmcO7b","vWB2ve","T7nuU 2","gjvCCd"
"Emmanuel Méndez","10 months ago","Kind of game you’ve got to dive into to fully enjoy it; it’s an extraordinary experience yet a short one.

Not everyone’s cup of tea, but I’d gladly recommend anyone to give it a try and really - really - get into it.
Definitely a favourite.","Was this review helpful to you?"
"Edward Charles","2 months ago","Playing the game right now. 
After finding it stupidly challenging, meaningless and boring, I find that it has no purpose. I keep playing because I were hoping it to get better but no. 
For a grungy game like this I was looking forward to a thrill. Instead I'm doing empty tasks that serve no intellectual calcubility. I'm walking around aimlessly hoping to bump into the right direction. 
The game is too dark. I have everything set to max brightness. I can't see a single thing when I need to the most, ending up missing my solution. Waste of time.","Was this review helpful to you?"
"Kristoffe Brodeur","9 months ago","This is far more than a game it's like a dream you encounter and want to make right. They're so much detail and beauty matched with horror I am in awe of this game. You really have to experience this is you can, the low the vibe is unreal.","Was this review helpful to you?"
"John Hazleton","9 months ago","Game of the year. The Pinnacle of fantastic storytelling and visuals combined on a level I've never seen before. One of the best gaming experiences I've had in the past 10 years. Games like this are what I wait for.","Was this review helpful to you?"
"S Rod","9 months ago","A beautiful cinematic game.  The story just as great.  For those giving bad reviews , you all are crazy and I say go back to playing Minecraft then.   Gameplay was limited but this was a beautiful game.","Was this review helpful to you?"
"Daniel Volosin","8 months ago","Should/Could have been a little longer, other than that it was an amazing experience!  If you're looking for a deep action game this one is not for you.  Visually the best console game to date!","Was this review helpful to you?"
"G o","9 months ago","Imma keep it a buck n give this game wht it needs…a boycott!! Yea the graphics are nice but Thts all it’s rinse n repeat the entire game ..the combat is lame the stages are lame nothing but rocks..rocks and more rocks with stupid puzzles and annoying white women talking to much..avoid at all costs unless it’s free ..hell avoid it then too..anyone giving this game a good rating must have been bought or they really love boring stories about finding giants names so u can fight them lol I see why Xbox suck this is why imma stick to the ps5","2 people found this helpful."
"Morcly","10 months ago","The game looks amazing and runs very smooth in my PC. The lowest FPS in a max ultra quality graphics is no less than 59 fps. Same concept than the 1st one but better graphics and more to the story basically. I do recommend it for PC players with a up-to-date PC.","5 people found this helpful."
"Lewis Soré","10 months ago","The game looks phenomenal , it's slow paced as the story builds up, but once you explore more of the game you forget its a game. How they managed to get this running in real-time is mindblowing...the audio feature is incredible...the gameplay is clearly not for everyone but it fulfilled it's purpose...thankyou Ninja Theory for this magical experience.","Was this review helpful to you?"
"Carolyn Dillon","10 months ago","I don't watch horror flicks and I am sift when it comes to human suffering so this game was a challenge If you are not a patient person thus game may be bit irritating for you because the action is few and far between The combat is challenging but never fear  there is a wonderful helper setting that I didn't discover til I was plenty frustrated and ready to quit lol  I'm sure this game is a cakewalk for some ... me, not so much The story is what kept me going !!!!","Was this review helpful to you?"
"Rich","4 months ago","This is among the worst games I've ever played.  It's a game that will have you wondering ""when can I play the game?""  It feels like your trudging through a swamp just holding forward on the joystick and pressing the sprint button barely has an effect.  Often times I wondered if I even needed to be using the controller...many times I didn't. The entire game is a somewhat controllable cut scene.  This game sucks","1 person found this helpful."
"Ahmed Rajput","9 months ago","to be honest im not happy with it i finished it yesterday game has so many great oppurtunity that developers lost first of alll its just a 5 to 6 hours of gameplay and about 80% of the game is senua walking and being sad . that game would be a hit if it has better fights and boss fights and imagine if its an open world game with tons of activity and stuff combat would be great if it was bit like god of war that game had potentail to be something great but in the end its just walking simulator .i was feeling good for about 2 hours then i was like oh my god when this is going to end .","1 person found this helpful."
"Landon Whitaker","10 months ago","Just wow!   This game is BEYOND beautiful and disturbing at the same time.  Must use headphones when playing it really brings u in.  Only thing bad I can say about it is that it is short.  Beautiful 💓💓💓","Was this review helpful to you?"
"Aaron dodd","10 months ago","HELLBLADE II REVIEW !!

( Prediction based 😎😜 4 hours to go) 😆 masterclass In storytelling, visuals, gameplay experience, topped off with an emotional and brilliantly handled deepdive and Enlightening insight into mental health. Enjoy 

Bang🗯 Potentially carved myself a Career in journalism. Watch this space 😆","10 people found this helpful."
"F Viveiros","9 months ago","My goodness...story, visuals amazing. Gameplay poor. Gosh I only wish Senua was more like God of War... it's like a movie with not much fun. Those puzzle to find the symbol, feels like a chore..  I want to stop playing everytime I come across one.. so boring!!!! Slow.. the combat is simple.  There is no evolving.. changing weapon.. getting stronger.  New moves.. 
I wish I could get a refund.","1 person found this helpful."
"Bongole Eldard","9 months ago","The story deserves an award though it was short, combat system is great though repetitive after some time , graphics are beautiful. The audio oooh God the audio it's the best I have experienced. This is a great game","Was this review helpful to you?"
"Ahmed Goran","9 months ago","People who call this game a “walking simulator” or an “interactive movie” have no idea what they’re talking about, as for the price, you could have gotten GamePass for a fraction of the full game’s price. It was an absolutely beautiful and amazing game in my opinion, great job from ninja theory.","Was this review helpful to you?"
"Reece Jones","10 months ago","Holy cheese balls what can I say that not already been said about this game is outstanding the audio the graphics the fighting it is all superb had me on the edge of my seat and I'm only 2 hours in just play it you won't regret it","Was this review helpful to you?"
"BABA YAGA","8 months ago","What I can say is that I am eagerly waiting for the third installment.
I wish someone would make some sort of web series on this game like witcher got and Cyberpunk in its development. Because masterpieces deserve this.","Was this review helpful to you?"
"Miguel Garcia","10 months ago","Puzzles were not challenging, and it was not as action pact as the first one. The puzzles also were repetitive. The game felt like a walkthrough with a narrated story. The ending was too abrupt too, not as emotional as the first game. I feel like they put all the focus and budget on graphics and called it a day. Truly sad, I had such high expectations; for it to be at least as good as the first one, but nope...","4 people found this helpful."
"Andrew Castillo","10 months ago","Finished the game and its a masterpiece! Amazing graphics, gameplay and story telling is top notch. Do not listen to the ps fan boys. This is amazing","1 person found this helpful."
"Matt","7 months ago","Certainly better than the 1st. Really enjoyed the personal relationships in this one & less rinse and repeat secret door mechanics. Enjoyed it a lot and was pleasantly surprised","Was this review helpful to you?"
"Caspian Caspiano","6 months ago","Honestly reviewing this game is unnecessary. It has everything that the first one didn’t and it lacks a little compared to the first. But none of that is particularly important, it’s a game outside the normal realm. 
A must play for true gamers","Was this review helpful to you?"
"EasyPeasyOnlineStore Ltd","10 months ago","The graphics alone in this game make it worth playing
It will take a little bit of time to get use to the puzzles and combat
But the story is looking great, the level of detail is amazing and looks and plays like a movie
It’s a wow for that alone
Definitely play it","Was this review helpful to you?"
"Andrew Toepfer","8 months ago","Its an incredibly beautiful game. The visuals are stunning and the audio is as insane and intense as the first came but it seems less involved. There is a lot of walking along and following someone else or a path and a lot less battles. I wish there was more freedom to roam and more fighting involved.","Was this review helpful to you?"
"Wyatt Rowley","9 months ago","Beautiful graphics, and that’s it. It’s like they took everything that was great about the first Hellblade, and scrapped it. The voices aren’t helpful, the puzzles are easier, the combat is all 1v1 and has no variety, the “boss fights” are all against the environment, and the final boss is a joke. Maybe it’s unfair to compare this to the first hellblade, but I was really hoping for a game that improved on the mechanics established in the first game, this just feels like an unnecessary sequel to an already well rounded game.","1 person found this helpful."
"Payam Asadi","9 months ago","I liked it but not as much as the first Hellblade. It's shorter, nothing new in game mechanics (except for The Mirror) and the puzzles are fewer and easier! It's just long walks and lots of talk with no action. It's like the first Hellblade should be the sequel! The first one had more gameplay.","Was this review helpful to you?"
"Lewis Hammond","10 months ago","First game to showcase mental health and use photo realistic gameplay for experience.

The game length is perfect coming from someone who has experienced many Pyscosis episodes.


Visual and auditory masterpiece.","Was this review helpful to you?"
"Matt Maeson","10 months ago","Beautiful game. Short and sweet. The attention to detail is insane. Some parts drag a bit but love seeing indie studios succeed and make something incredible.","3 people found this helpful."
"Luc Beni","10 months ago","Played the first level so far. You just need to press forward and sometimes click! They should have done a youtube video out of it, it would have been the same (since you need to click on ads sometimes).
Graphics are cool though.","4 people found this helpful."
"Basilio Sande","8 months ago","This game is pure art! Just play it, worth the experience. every single thing was done to perfection. Well done to everyone involved in developing this game well done! 👏🏾","Was this review helpful to you?"
"RED WINGS FOREVER","10 months ago","Wow, they absolutely nailed it. Spent a LOT of time on the first one and this is everything and more. 100 percent!

Make the next one a bit longer though!","Was this review helpful to you?"
"Jadran Cuzela","10 months ago","It looks like you are playing a movie. Stunning. 
Gameplay is also good, not perfect, but very good. 

Worth waiting definitely.

Playing on xbox s. Top quality","3 people found this helpful."
"Jason Gilbert","7 months ago","This game is way up it's own rear. Tries way too hard, and is a constant eyeroll. It's barely even a video game and has spent way too much wasted time trying to make it into a movie also prepare to walk ALOT. Just make a movie instead if that's what your going for otherwise spend more time allowing us to actually be Senua like Kratos where it's done right.","1 person found this helpful."
"Henry Gonzales","a month ago","One of the best games I've ever played I didn't like the first one but this one god they improved so much and it's way better than the first Hellblade highly recommend playing this one if your new into hellblade I'd say start with this one too.","Was this review helpful to you?"
"Rational Utah","10 months ago","The game is fantastic. I am so burned out with open world games. This game is a masterpiece and hits the right spot. I will play it through at least a few times.","Was this review helpful to you?"
"Adi","9 months ago","This is a game for schizophrenic fvks. Thats all

If there's 5 star rating from people of any kind, and you are paying for this, trust me, those people are schizo brainded people. I will give -10 star if the option were present.

Warning before you played the game are present, traumas, psychosis, etc.
Even cyberpunk 2077 cyberpsychos are still better than this game","Was this review helpful to you?"
"Vinnie Liotta","7 months ago","Simply gorgeous graphics; is like playing a character in a movie. Sword combat is a bit frustrating and clunky. Puzzles are great fun. Would I recommend this game? Absolutely. I loved it.","Was this review helpful to you?"
"george thomas","10 months ago","The graphics are great five star, if you've got a GPU that can play the game at full specs, the sound is good to, so why only one star, the game play, there is none, you can't die, there is no multiple endings only about 9 hr of game play, the combat is boring and the puzzles are a joke. I can sum up this game in one sentence.
Graphics over gameplay and I'd rather have great gameplay. I've got the game on PC, on xbox  game pass, my system is a  RTX 3090  TI, i 7, 32 gb.","3 people found this helpful."
"last Key","10 months ago","I LOVE THE GAME I BEEN WAITING SINCE sophomore year get part 2 to this game and it was most definitely worth the wait im also graduating now best game I have blade in awhile!!! Please make a part 3🫶","Was this review helpful to you?"
"Mark Kuczewski","7 months ago","Great visuals but it forgets that’s it’s also a game that is to be played. The playable sections you’ll mainly be holding the thumb stick forward with a few combat scenarios. It’s also incredibly short which increases the frustration when the majority of the time you’re just watching cutscenes.","1 person found this helpful."
"Zack 218","9 months ago","Holy hell dude I spent an entire hour just slowly walking and hearing stupid voices. There’s absolutely NOTHING good about this game like literally NOTHING. Theres no fightin, there’s no equips or stats. All you do is walk incredibly slow for hours down a designated path and hear voices from time to time","1 person found this helpful."
"David Hujik","10 months ago","With it being 5 or 6 years in the making and taken things out of the game the first one had and it being 6 hours long. I'd say this is another Xbox fail.  Hi fi rush won awards and peoples love yet they closed down the studios. It's time to go full 3rd party Xbox it's just time.","5 people found this helpful."
"Anthony Sousa","9 months ago","Not a traditional game by any means.  Its a cinematic experience. Like you’re playing a movie.  Even if it’s something you cant finish, I think it’s something everyone can acknowledge as beautiful and unique.","Was this review helpful to you?"
"Scott Barnes","10 months ago","The game looks and sounds incredible. The problem is that this game is one you play through one time and never play again. If you own gamepass then you are good. Not worth buying at all, waste of money.","Was this review helpful to you?"
"Whats Up Broda","9 months ago","The game is absolutely amazing and focus important lessons. Let's just when I complete the game I was sad and wish it was longer. I'm buying it just to support the creators.","Was this review helpful to you?"
"Andrew L","4 months ago","Not sure how to rate this. Feel like a different game compare to the 1st one.  

In Hellblade 2, there are companions but they just follow you around and won't assist you in fight. They assist only during cutscene.

Also, there are more walking in Hellblade 2.","Was this review helpful to you?"
"Gihan Sampath","10 months ago","I have 4 more hours left to finish the game but i can tell that team xbox and ninja theory released the first ever next gen game to the console  and cc market, a true gen audio and visually combat is also good (better than first one) puzzle are also not bad, but this game demands a good pc had some performance issues that is the only con for now,

Best of luck Team Ninja and to the Team Hellblade","Was this review helpful to you?"
"Johnny Sykes","10 months ago","Gave it three because graphics are really fricking good, I think it is a well made and probably great game, shame I’m about to turn it off after almost two hours playing because I don’t think it is my kind of game though, out of the two hours playing it has been really slow, lots of story watching, irritating whispering voices saying the same thing basically over and over, idk man I may turn it back on tomorrow… maybe ll lyk.","4 people found this helpful."
"Keiran Stroud","8 months ago","Such a boring walking simulator with very little game play outside the cut scenes. All fights feel scripted and no actual skill level is needed.
Iv given up after a hour and a half of doing close to nothing. 
Pretty sure they forgot this was ment to be a game not a awful paced film.","1 person found this helpful."
"Darryl Mark","10 months ago","It plays like a full cinematic movie. The graphics are out of this world. The combat system is simple but engaging. Great game!","Was this review helpful to you?"
"Eric Aho","10 months ago","Like playing a movie, great gameplay, characters with realistic emotion great Ray tracing  and some of the best sound scape I have ever heard. Sets a new standard for graphics for games.","Was this review helpful to you?"
"Terri Ruff","7 months ago","This took me 2 days to complete , absolutely loved every second and the challenges on her journey , only downfall I don’t think the game was long enough need more chapters and more giants , cinematic experience was 100%","Was this review helpful to you?"
"michael richvalsky","10 months ago","I had trouble getting through the first game but this game is absolutely amazing. The graphics and story are insane you feel every bit of it.","Was this review helpful to you?"
"Nima Ferdosi","9 months ago","I love video games because of games like Hellblade II, the experience is pure magic!
The story is captivating, the graphics are insane and the game mechanics, puzzles and OMG the AUDIO DESIGN is spectacular!","Was this review helpful to you?"
"Sam the story man McArthur","10 months ago","I’m only 3 hours in but I’m loving it, feels like the first one but better, I’m enjoying all the story and characters but what really makes me fall in love with it is how it looks and feels, the fights feel intense and interesting and everything looks spectacular","1 person found this helpful."
"Christopher Anderson","9 months ago","10/10 experience. A must play. Not much of a game but  Definitely worth playing but if you rate it based on game mechanics it's a 6/7","Was this review helpful to you?"
"Vitaly Vraby","10 months ago","I'm about 7 hours in the game. Just done with second giant . I'm impressed, best looking game so far. 
Everything is top quality. Masterpiece 10/10.","3 people found this helpful."
"John Everimanne","9 months ago","Half the length of the original and abruptly ends long before you think it will. I'm going over the possible reasons in my head. My guess is incompetent management and higher-ups. That's always the case. I have now idea what Xbox is trying to do anymore. But I'm done supporting it.","Was this review helpful to you?"
"Jay DaBigTymer","10 months ago","This game is absolutely amazing & is easily my favorite game this gen.. The first Hellblade is in my top 5 favorite games of all time & Hellblade 2 is even better so its obviously also in my top 5 favorite games of all time 🔥🔥🔥🔥🔥","1 person found this helpful."
"Charlie Szabo","2 months ago","Wish I could give this game infinite stars I truly believe every person should have the chance to play this game as well as the prequel absolutely masterful Audio and storytelling beautiful game I really really hope they make another","Was this review helpful to you?"
"Rustin' Cohle","10 months ago","A SOLID 10/10 this is the most visually Beautiful game ive ever ever seen, the gameplay, the story, everything!!!! It's perfect, PERFECT!!! Everything!! Down to the last minute details.","Was this review helpful to you?"
"Tim Aucoin Screenwriter","10 months ago","Incredible visuals. Like nothing I've ever seen before or knew was possible on the Xbox series X. 10 out of 10 for me.","Was this review helpful to you?"
"Joe Myers","10 months ago","The story and graphics are really good but I went with 4 stars because of the fighting moves. She seems slower and less speed paced combos. You can't carry as much of a chain in her combos either.","Was this review helpful to you?"
"Nollus Deventer","10 months ago","Amazing experience!  This is not a typical 'game' but a +/- 8 hours audiovisual experience in game form... Stunning graphics and sounddesign is top notch. 10/10 for what it is!","Was this review helpful to you?"
"James Ash","10 months ago","One of the best looking games I’ve ever seen love it. I’ve recommended don’t listen to the haters. What a beautiful piece of art, wonderful journey","Was this review helpful to you?"
"sabur salh","10 months ago","It's a very good game in terms of story, in terms of combat and fighting is very real, in terms of sound there is no game like it and in terms of cinematic scenery like The Last of Us  Because this game told gamers earlier that it would be a cinematic game like the last of us part","Was this review helpful to you?"
"Mia Watkins","7 months ago","this game is so great, replayed at least twice now, 100% reccomend for any horror/thriller/adventure fans. cant wait for a third one","Was this review helpful to you?"
"Christo Spellz","10 months ago","Amazing squad based game. One of my favorite games ever. Constantly changing and evolving.  All around best game of the year.","Was this review helpful to you?"
"Gamer Guru","10 months ago","Great piece of art. No it's not a hack and slash or 200+ hour collection grind, it's not cod or Fortnite either go figure smooth brains would moan about that.","Was this review helpful to you?"
"Lee Quine","9 months ago","This is an outstanding game great gameplay, great story, visually brilliant. 
I really enjoy how the whole game feels like you are watching a film.","Was this review helpful to you?"
"Alexander Ball","10 months ago","Great game, nice slow pace compared to some recent games I played which is great for a change. Stunning visuals and sound/music.","Was this review helpful to you?"
"Darius Singleton","10 months ago","Well... the wait was well worth it. It's so smooth between the cutscenes & actual gameplay. Absolutely amazing 👏🏾 🤩","1 person found this helpful."
"Bandile Owethu","10 months ago","It's a good game, very cinematic 👌( purchased Game Pass Ultimate )  played it from start to finish for hours, it was worth it. personally rate it 9/10.","Was this review helpful to you?"
"Shivam Uttam","3 months ago","worst combat systems of all time in part 1 it was still decent but in 2 it become unbearable the evade tactics was working far better in 1 but in 2 it's a nightmare. i got annoyed by it's weak combat system in 30 mins of playing most time it feels it's a video were we are just suppose to watch not play.","Was this review helpful to you?"
"Larissa Lopes","6 months ago","Best video game i have ever played. Story telling 10/10. Acting 10/10. Voice acting 10/10. Music 10/10. Symbolic messaging 10/10. Graphics 10/10. I love how AURORA sings when the credits roll. It really perfected it.","Was this review helpful to you?"
"Craig Geren","9 months ago","Super impressed! visually the game is astounding. The audio is superb. It’s not a short game, but not long in the tooth either.","Was this review helpful to you?"
"Edwin Rodríguez","8 months ago","I am pretty sure this will be my game of the year. Played it 3 times back to back. What am amazing story about the frailty of human nature.","Was this review helpful to you?"
"Austin Geary","9 months ago","Amazing story driven experience. Visually and audibly immersive. Possibly the best graphics I've seen in a video game.","Was this review helpful to you?"
"Justin Medil","8 months ago","The best looking game this Gen for me, kudos to Ninja theory and Xbox game studios, finished this hame on GeforceNOW using PC gamepass, a must play game, 8/10 overall for me.","Was this review helpful to you?"
"Sergio Perez","9 months ago","This game is amazing. Great gameplay and stunning graphics. Feels like I'm playing a movie if that makes sense.","Was this review helpful to you?"
"Adam Goncalo (Adam G)","9 months ago","Amazing game. Definitely trumps the first imo. Fighting controls could be a bit better but amazing visuals on the Series X.","Was this review helpful to you?"
"Frank Perna","9 months ago","Game is trash 0 stars it's just three cut scenes and then a cave with a door then it's over I speed ran this would've been quicker if I could skip the cut scenes with mostly awesome artwork that was the only thing good and the voices dont make you feel crazy it whatever they're just annoying","Was this review helpful to you?"
